535;706;6559365;ASGR;75-0393-31-02;BOXER BORDEAUX  SEAMLESS BÁSICO - T.2;1;$449,95 ;89,99 ;$359,96 ;64,79 ;295,17 ;220;P    Oportunidad Boxer Seamless 2x $899.90
535;706;6559365;ASGO;75-0393-04-02;BOXER AZUL NAVY  SEAMLESS BÁSICO - T.2;1;$449,95 ;89,99 ;$359,96 ;64,79 ;295,17 ;220;P    Oportunidad Boxer Seamless 2x $899.90
535;706;6564079;APHU;00-5653-02-03;CAPRI NEGRO  CON TIRAS LATERALES - T.3;1;$689,90 ;0,00 ;$689,90 ;68,99 ;620,91 ;220;PR5  GANGAS DE ENERO  
535;706;6564079;ALMB;6H-2000-61-02;MUSCULOSA PURPURA  CON ESPALDA CAVADA - T.M;1;$449,90 ;0,00 ;$449,90 ;44,99 ;404,91 ;220;PR5  GANGAS DE ENERO  
;704;6559376;AYHF;67-0277-02-03;REMERA NEGRO  CON RECORTE DE MICROTUL - T.L;1;$799,90 ;239,97 ;$559,93 ;100,79 ;459,14 ;220;P    Extra Descuento 5%
;704;6559376;AXOA;02-0619-02-02;REMERA NEGRO  HOMBROS DESCUBIERTOS - T.2;1;$699,90 ;209,97 ;$489,93 ;88,19 ;401,74 ;220;P    Extra Descuento 5%
;704;6559376;AXVU;20-2018-82-02;MUSCULOSA VERDE OLIVA  ESCOTE CUADRADO - T.M;1;$799,95 ;199,99 ;$599,96 ;107,99 ;491,97 ;220;P    Oportunidad Musculosa Escote Cuadrado Morley 2x $1599.90
;704;6559376;AXPY;07-4032-02-03;SHORT NEGRO  COMBINADO CON CINTA SUBLIMADA - T.L;1;$899,90 ;269,97 ;$629,93 ;113,39 ;516,54 ;220;P    Extra Descuento 5%
;704;6559376;AXVP;20-2018-02-03;MUSCULOSA NEGRO  ESCOTE CUADRADO - T.L;1;$799,95 ;199,99 ;$599,96 ;107,99 ;491,97 ;220;P    Oportunidad Musculosa Escote Cuadrado Morley 2x $1599.90
;704;6559376;AYKJ;67-0664-5B-04;REMERA VERDE MELANGE  ESTAMPADO FULL PRINT AVES - T.XL;1;$1.049,90 ;314,97 ;$734,93 ;132,29 ;602,64 ;220;P    Extra Descuento 5%
;704;6559376;AXVY;20-2018-85-03;MUSCULOSA MANDARINA  ESCOTE CUADRADO - T.L;1;$799,95 ;199,99 ;$599,96 ;107,99 ;491,97 ;220;P    Oportunidad Musculosa Escote Cuadrado Morley 2x $1599.90
;704;6559376;AYCL;3S-0001-33-02;REMERA LIMÓN  COMBINADA ELÁSTICO CON TRANSPARENCIA - T.M;1;$899,90 ;269,97 ;$629,93 ;113,39 ;516,54 ;220;P    Extra Descuento 5%
;704;6559376;AXIK;08-4588-89-02;SHORT AMARILLO BEBE  DE BAÑO PRINT SEASHELLS - T.M;1;$979,93 ;0,00 ;$979,93 ;97,99 ;881,94 ;220;P    Free Premiums
;704;6559376;AXVQ;20-2018-13-01;MUSCULOSA AMARILLO  ESCOTE CUADRADO - T.S;1;$799,95 ;199,99 ;$599,96 ;107,99 ;491,97 ;220;P    Oportunidad Musculosa Escote Cuadrado Morley 2x $1599.90
;704;6559376;AUHC;3A-4000-02-01;SHORT NEGRO  SUPERPUESTO - T.S;1;$1.299,90 ;389,97 ;$909,93 ;163,79 ;746,14 ;220;P    Extra Descuento 5%
;704;6559376;AXNR;00-8038-82-01;TOP VERDE OLIVA  CAMUFLADO - T.1;1;$899,90 ;269,97 ;$629,93 ;113,39 ;516,54 ;220;P    Extra Descuento 5%
;1019;6559331;AYER;5P-2001-19-02;MUSCULOSA OBISPO  COMBINADA DETALLE RÉFLEX - T.M;1;$899,90 ;224,98 ;$674,93 ;121,49 ;553,44 ;220;P    Extra Descuento 5%
;1019;6559331;AXOQ;03-0891-02-04;"REMERA NEGRO  ""GOOD INTENTIONS BAD HABITS"" - T.XL";1;$949,90 ;237,48 ;$712,43 ;128,24 ;584,19 ;220;P    Extra Descuento 5%
;1019;6559331;AYND;67-2178-14-01;VESTIDO FRANCIA  CON APLIQUE BOCA - T.S;1;$1.299,90 ;324,98 ;$974,93 ;175,49 ;799,44 ;220;P    Extra Descuento 5%
;1019;6559331;AOUS;6C-0001-02-03;REMERA NEGRO  CON TAJOS LATERALES - T.L;1;$649,94 ;0,00 ;$649,94 ;64,99 ;584,95 ;220;P    Free Premiums
;1019;6559331;AYMK;67-2172-02-03;VESTIDO NEGRO  CON RECORTE COMBINADO EN MICROTUL - T.L;1;$1.049,90 ;262,48 ;$787,43 ;141,74 ;645,69 ;220;P    Extra Descuento 5%
;1019;6559331;AYEX;60-3025-27-01;LEGGING GRIS PLOMO  ESTAMPADO ACEBRADO  - T.1;1;$1.599,90 ;399,98 ;$1.199,93 ;215,99 ;983,94 ;220;P    Extra Descuento 5%
;1019;6559331;AXOA;02-0619-02-02;REMERA NEGRO  HOMBROS DESCUBIERTOS - T.2;2;$699,90 ;349,95 ;$1.049,85 ;188,97 ;860,88 ;220;P    Extra Descuento 5%
;1019;6564054;AYNV;6F-2003-02-03;VESTIDO NEGRO  CON VISTA COMBINADA - T.L;1;$1.599,90 ;479,97 ;$1.119,93 ;201,59 ;918,34 ;220;P    Extra Descuento 5%
;1019;6564054;AYJZ;67-0662-1G-02;"REMERA AMARILLO INTENSO  ""CVKD""  T.M";1;$949,90 ;284,97 ;$664,93 ;119,69 ;545,24 ;220;P    Extra Descuento 5%
;1019;6564054;AXTV;12-2094-02-03;MUSCULOSA NEGRO  CON CINTA SUBLIMADA EN ESPALDA - T.L;1;$949,90 ;284,97 ;$664,93 ;119,69 ;545,24 ;220;P    Extra Descuento 5%
535;898;6559296;AYCR;3S-9000-01-02;MINIFALDA BLANCO  CRUZADA CON SHORT INTERNO - T.2;1;$1.349,90 ;337,48 ;$1.012,43 ;182,24 ;830,19 ;220;P    Extra Descuento 5%
535;898;6559296;AYSY;75-0469-14-02;BOXER FRANCIA  COLOR BLOCK - T.2;1;$599,90 ;149,98 ;$449,93 ;80,99 ;368,94 ;220;P    Extra Descuento 5%
535;898;6559296;AYOU;74-0502-1C-01;"REMERA BEIGE  ""GREAT THINGS..."" - T.S";1;$949,90 ;237,48 ;$712,43 ;128,24 ;584,19 ;220;P    Extra Descuento 5%
535;898;6559296;AXWT;24-3091-02-02;LEGGING NEGRO  CON RECORTES Y ESTAMPA LATERAL - T.2;1;$1.899,90 ;474,98 ;$1.424,93 ;256,49 ;1168,44 ;220;P    Extra Descuento 5%
535;898;6559296;AYHC;67-0276-02-03;VESTIDO NEGRO  CON GALÓN - T.L;1;$1.099,90 ;274,98 ;$824,93 ;148,49 ;676,44 ;220;P    Extra Descuento 5%
535;898;6559296;AYXA;90-9876-06-00;GORRA FUCSIA  DEPORTIVA PRINT DEGRADÉ - T.UNICO-TU;1;$659,94 ;0,00 ;$659,94 ;65,99 ;593,95 ;220;P    Free Premiums
535;898;6559296;AXWW;24-3093-02-01;LEGGING NEGRO  COMBINADO CON FRANJA ACEBRADA - T.1;1;$1.499,90 ;374,98 ;$1.124,93 ;202,49 ;922,44 ;220;P    Extra Descuento 5%
535;898;6564070;AYSF;75-0463-03-02;BOXER ROJO  RAYAS COMBINADAS - T.2;1;$599,90 ;149,98 ;$449,93 ;80,99 ;368,94 ;220;P    Extra Descuento 5%
535;898;6564070;AYSZ;75-0469-14-03;BOXER FRANCIA  COLOR BLOCK - T.3;1;$599,90 ;149,98 ;$449,93 ;80,99 ;368,94 ;220;P    Extra Descuento 5%
535;898;6564070;AYSG;75-0463-03-03;BOXER ROJO  RAYAS COMBINADAS - T.3;1;$599,90 ;149,98 ;$449,93 ;80,99 ;368,94 ;220;P    Extra Descuento 5%
;113;6559320;AYHC;67-0276-02-03;VESTIDO NEGRO  CON GALÓN - T.L;1;$1.099,90 ;329,97 ;$769,93 ;138,59 ;631,34 ;220;P    Extra Descuento 5%
;113;6559320;AXJD;6C-0001-9A-02;REMERA NARANJA FLUO  CON TAJOS LATERALES - T.M;1;$599,94 ;0,00 ;$599,94 ;59,99 ;539,95 ;220;P    Free Premiums
;113;6559320;AUIL;4B-4016-02-01;SHORT NEGRO  COMBINADO CON POWER SOFT SILVER - T.S;1;$1.299,90 ;389,97 ;$909,93 ;163,79 ;746,14 ;220;P    Extra Descuento 5%
;113;6559320;AYCA;3Q-2000-23-02;MUSCULOSA CORAL  CON TAJOS LATERALES - T.M;1;$799,95 ;199,99 ;$599,96 ;107,99 ;491,97 ;220;P    Oportunidad Musculosa Tejido flamé 2x $1599.90
;113;6559320;AXWR;24-3090-02-02;LEGGING NEGRO  CON ESTAMPA Y CINTURA COMBINADA - T.2;1;$1.139,94 ;0,00 ;$1.139,94 ;113,99 ;1025,95 ;220;P    Free Premiums
;113;6559320;AXNV;00-8040-9A-01;BANDÓ NARANJA FLUO  CLÁSICO - T.1;1;$499,90 ;149,97 ;$349,93 ;62,99 ;286,94 ;220;P    Extra Descuento 5%
;113;6559320;AYNF;67-2178-14-03;VESTIDO FRANCIA  CON APLIQUE BOCA - T.L;1;$1.299,90 ;389,97 ;$909,93 ;163,79 ;746,14 ;220;P    Extra Descuento 5%
;113;6559320;AXXT;24-8013-01-01;TOP BLANCO  CON RECORTE DE MICROTUL AL TONO - T.1;1;$699,90 ;209,97 ;$489,93 ;88,19 ;401,74 ;220;P    Extra Descuento 5%
;113;6559320;AYCN;3S-4000-01-01;SHORT BLANCO  COMBINADO CON ESTAMPA EN RECORTE - T.S;1;$899,90 ;269,97 ;$629,93 ;113,39 ;516,54 ;220;P    Extra Descuento 5%
;113;6559320;ATYJ;6C-0001-19-02;REMERA OBISPO  CON TAJOS LATERALES - T.M;1;$999,90 ;299,97 ;$699,93 ;125,99 ;573,94 ;220;P    Extra Descuento 5%
;113;6559320;AYBX;3Q-2000-11-02;MUSCULOSA CELESTE  CON TAJOS LATERALES - T.M;1;$799,95 ;199,99 ;$599,96 ;107,99 ;491,97 ;220;P    Oportunidad Musculosa Tejido flamé 2x $1599.90
;113;6559320;AYNE;67-2178-14-02;VESTIDO FRANCIA  CON APLIQUE BOCA - T.M;1;$1.299,90 ;389,97 ;$909,93 ;163,79 ;746,14 ;220;P    Extra Descuento 5%
;944;6559349;AZBK;90-7284-12-00;SOQUETE GRIS MELANGE  INVISIBLE RAYAS RAINBOW - T.UNICO-TU;1;$269,90 ;67,48 ;$202,43 ;36,44 ;165,99 ;220;P    Extra Descuento 5%
;944;6559349;AYHB;67-0276-02-02;VESTIDO NEGRO  CON GALÓN - T.M;1;$1.099,90 ;274,98 ;$824,93 ;148,49 ;676,44 ;220;P    Extra Descuento 5%
;944;6559349;AXWG;20-2020-02-02;BODY NEGRO  CON VISTA A CONTRATONO - T.2;1;$559,93 ;0,00 ;$559,93 ;55,99 ;503,94 ;220;P    Free Premiums
;944;6559349;AYGH;67-0271-45-02;REMERA VERDE FLUO  BÁSICA - T.M;1;$699,95 ;139,99 ;$559,96 ;100,79 ;459,17 ;220;P    Oportunidad Remera Básica Jersey fine 2X 1399.90
;944;6559349;AYPQ;81-4031-01-03;SHORT BLANCO  CON RED SUPERPUESTA EN LATERAL - T.L;1;$1.149,90 ;287,48 ;$862,43 ;155,24 ;707,19 ;220;P    Extra Descuento 5%
;944;6559349;AZBS;67-0271-97-02;REMERA CORAL FLUO  BÁSICA - T.M;1;$699,95 ;139,99 ;$559,96 ;100,79 ;459,17 ;220;P    Oportunidad Remera Básica Jersey fine 2X 1399.90
;944;6559349;AVSK;07-3063-02-02;PANTALON NEGRO  COMBINADO CON ELASTICO CON TRANSPARENCIA Y E;1;$1.499,90 ;374,98 ;$1.124,93 ;202,49 ;922,44 ;220;P    Extra Descuento 5%
;944;6559349;AXPU;07-3067-02-02;PANTALON NEGRO  CROPPED CINTURA ELÁSTICA CON LOGO - T.M;1;$1.099,90 ;274,98 ;$824,93 ;148,49 ;676,44 ;220;P    Extra Descuento 5%
;944;6564071;AXOU;03-0892-04-04;"REMERA AZUL NAVY  COLOR-BLOCK ""VK NO LIMITS"" - T.XL";1;$1.099,90 ;329,97 ;$769,93 ;138,59 ;631,34 ;220;P    Extra Descuento 5%
;944;6564071;AZBK;90-7284-12-00;SOQUETE GRIS MELANGE  INVISIBLE RAYAS RAINBOW - T.UNICO-TU;1;$269,90 ;80,97 ;$188,93 ;34,01 ;154,92 ;220;P    Extra Descuento 5%
;944;6564071;AYKM;67-0665-72-03;REMERA GRIS MELANGE OSCURO  COLOR-BLOCK CON ESTAMPA EN RECOR;1;$1.149,90 ;344,97 ;$804,93 ;144,89 ;660,04 ;220;P    Extra Descuento 5%
;958;6559367;AWDM;4B-4502-02-03;SHORT NEGRO  DEPORTIVO COMBINADO CINTA REFLEX - T.L;1;$1.399,90 ;349,98 ;$1.049,93 ;188,99 ;860,94 ;220;P    Extra Descuento 5%
;958;6559367;AYEL;5P-0002-14-02;REMERA FRANCIA  COMBINADA DETALLE LASER TECH - T.M;1;$899,90 ;224,98 ;$674,93 ;121,49 ;553,44 ;220;P    Extra Descuento 5%
;958;6559367;AYCG;3Q-7000-1A-00;KIMONO MOSTAZA  BÁSICO - T.UNICO-TU;1;$1.499,90 ;374,98 ;$1.124,93 ;202,49 ;922,44 ;220;P    Extra Descuento 5%
;958;6559367;AYCZ;56-2046-78-02;MONO ROSA  ESCOTE CRUZADO CON LAZO - T.M;1;$1.299,90 ;324,98 ;$974,93 ;175,49 ;799,44 ;220;P    Extra Descuento 5%
;958;6559367;AXOP;03-0891-02-03;"REMERA NEGRO  ""GOOD INTENTIONS BAD HABITS"" - T.L";1;$949,90 ;237,48 ;$712,43 ;128,24 ;584,19 ;220;P    Extra Descuento 5%
;771;6559330;AXTF;12-2089-02-02;"MUSCULOSA NEGRO  COMBINADA ""STRONG"" - T.M";1;$1.099,90 ;274,98 ;$824,93 ;148,49 ;676,44 ;220;P    Extra Descuento 5%
;771;6559330;AUIN;4B-4016-02-03;SHORT NEGRO  COMBINADO CON POWER SOFT SILVER - T.L;1;$1.299,90 ;324,98 ;$974,93 ;175,49 ;799,44 ;220;P    Extra Descuento 5%
276;804;6559474;APHQ;00-4027-25-01;CICLISTA PLATEADO  CON RECORTES EN MICROTUL - T.1;1;$689,90 ;0,00 ;$689,90 ;68,99 ;620,91 ;220;PR5  GANGAS DE ENERO  
276;804;6559484;AYKO;67-0666-72-01;REMERA GRIS MELANGE OSCURO  AIRBRUSHED PRINT CON BOLSILLO - ;1;$1.149,90 ;287,48 ;$862,43 ;155,24 ;707,19 ;220;P    Extra Descuento 5%
;1016;6559298;ACKX;70-0098-02-03;CULOTTE NEGRO  DE BAÑO TIRO ALTO - T.3;1;$949,90 ;284,97 ;$664,93 ;119,69 ;545,24 ;220;P    Extra Descuento 5%
;1016;6559298;ASGP;75-0393-04-03;BOXER AZUL NAVY  SEAMLESS BÁSICO - T.3;1;$449,95 ;112,49 ;$337,46 ;60,74 ;276,72 ;220;P    Oportunidad Boxer Seamless 2x $899.90
;1016;6559298;AQNQ;76-4002-02-03;CICLISTA NEGRO  CON RECORTE EN MICROTUL - T.3;1;$1.499,90 ;449,97 ;$1.049,93 ;188,99 ;860,94 ;220;P    Extra Descuento 5%
;1016;6559298;ASGS;75-0393-31-03;BOXER BORDEAUX  SEAMLESS BÁSICO - T.3;1;$449,95 ;112,49 ;$337,46 ;60,74 ;276,72 ;220;P    Oportunidad Boxer Seamless 2x $899.90
;1016;6559298;AYPM;7P-2000-01-02;MUSCULOSA BLANCO  ESCOTE HALTER MULTICOLOR - T.2;1;$859,90 ;257,97 ;$601,93 ;108,35 ;493,58 ;220;P    Extra Descuento 5%
;1016;6559298;AYSG;75-0463-03-03;BOXER ROJO  RAYAS COMBINADAS - T.3;2;$599,90 ;359,94 ;$839,86 ;151,17 ;688,69 ;220;P    Extra Descuento 5%
;1016;6559298;AXRO;0R-2000-02-02;MUSCULOSA NEGRO  ESCOTE HALTER - T.2;1;$799,90 ;239,97 ;$559,93 ;100,79 ;459,14 ;220;P    Extra Descuento 5%
;1016;6559298;AYCE;3Q-2000-1D-03;MUSCULOSA AMARILLO NEÓN  CON TAJOS LATERALES - T.L;1;$949,90 ;284,97 ;$664,93 ;119,69 ;545,24 ;220;P    Extra Descuento 5%
;1016;6559298;AYCE;3Q-2000-1D-03;MUSCULOSA AMARILLO NEÓN  CON TAJOS LATERALES - T.L;1;$799,95 ;199,99 ;$599,96 ;107,99 ;491,97 ;220;P    Oportunidad Musculosa Tejido flamé 2x $1599.90
;1016;6559298;AYSZ;75-0469-14-03;BOXER FRANCIA  COLOR BLOCK - T.3;1;$599,90 ;179,97 ;$419,93 ;75,59 ;344,34 ;220;P    Extra Descuento 5%
;1016;6559298;AYNL;67-2180-1D-01;MUSCULOSA AMARILLO NEÓN  CON CUELLO COMBINADO - T.1;1;$749,90 ;224,97 ;$524,93 ;94,49 ;430,44 ;220;P    Extra Descuento 5%
;1016;6559298;AYCA;3Q-2000-23-02;MUSCULOSA CORAL  CON TAJOS LATERALES - T.M;1;$799,95 ;199,99 ;$599,96 ;107,99 ;491,97 ;220;P    Oportunidad Musculosa Tejido flamé 2x $1599.90
;1016;6559298;AXXA;24-4008-02-03;CICLISTA NEGRO  BÁSICO - T.3;1;$1.349,90 ;404,97 ;$944,93 ;170,09 ;774,84 ;220;P    Extra Descuento 5%
;869;6564075;ATYJ;6C-0001-19-02;REMERA OBISPO  CON TAJOS LATERALES - T.M;1;$699,93 ;0,00 ;$699,93 ;69,99 ;629,94 ;220;P    Free Premiums
;869;6564075;AYQZ;90-0017-45-00;CUELLO VERDE FLUO  PRINT SPORTY - T.UNICO-TU;1;$399,90 ;99,98 ;$299,93 ;53,99 ;245,94 ;220;P    Extra Descuento 5%
;869;6564075;AYHN;67-0279-03-02;VESTIDO ROJO  REMERÓN CON TEJIDO EN RUEDO - T.M;1;$1.499,90 ;374,98 ;$1.124,93 ;202,49 ;922,44 ;220;P    Extra Descuento 5%
;869;6564075;AYNE;67-2178-14-02;VESTIDO FRANCIA  CON APLIQUE BOCA - T.M;1;$1.299,90 ;324,98 ;$974,93 ;175,49 ;799,44 ;220;P    Extra Descuento 5%
;869;6564081;AYEF;5L-3002-93-02;PANTALÓN CRUDO MELANGE  CROPPED CON GALÓN LATERAL  T.M;1;$999,90 ;0,00 ;$999,90 ;99,99 ;899,91 ;220;PR5  GANGAS DE ENERO  
;869;6564081;AXWD;20-2019-85-02;MUSCULOSA MANDARINA  COLOR-BLOCK - T.M;1;$589,90 ;0,00 ;$589,90 ;58,99 ;530,91 ;220;PR5  GANGAS DE ENERO  
;869;6564075;AYSA;75-0461-02-03;TOP NEGRO  CON TIRAS CRUZADAS - T.3;1;$799,90 ;199,98 ;$599,93 ;107,99 ;491,94 ;220;P    Extra Descuento 5%
;869;6564075;AYHB;67-0276-02-02;VESTIDO NEGRO  CON GALÓN - T.M;1;$1.099,90 ;274,98 ;$824,93 ;148,49 ;676,44 ;220;P    Extra Descuento 5%
;965;6559384;AXNT;00-8039-1D-01;TOP AMARILLO NEÓN  COMBINADO ELÁSTICO CON LOGO - T.1;1;$1.049,90 ;262,48 ;$787,43 ;141,74 ;645,69 ;220;P    Extra Descuento 5%
;965;6559384;AYHD;67-0277-02-01;REMERA NEGRO  CON RECORTE DE MICROTUL - T.S;1;$799,90 ;199,98 ;$599,93 ;107,99 ;491,94 ;220;P    Extra Descuento 5%
;965;6559384;AYLL;67-2170-01-02;"MUSCULOSA BLANCO  ""SAVAGE SIDE"" - T.M";1;$899,90 ;224,98 ;$674,93 ;121,49 ;553,44 ;220;P    Extra Descuento 5%
276;840;6559436;AYHX;67-0282-18-03;REMERA VERDE ENERGIA  BOLSILLO LENTEJUELAS - T.L;1;$949,90 ;237,48 ;$712,43 ;128,24 ;584,19 ;220;P    Extra Descuento 5%
276;840;6559436;AYPQ;81-4031-01-03;SHORT BLANCO  CON RED SUPERPUESTA EN LATERAL - T.L;1;$1.149,90 ;287,48 ;$862,43 ;155,24 ;707,19 ;220;P    Extra Descuento 5%
276;840;6559436;AXUO;15-3025-02-03;PANTALON NEGRO  PALAZZO CON PINZAS - T.L;1;$1.399,90 ;349,98 ;$1.049,93 ;188,99 ;860,94 ;220;P    Extra Descuento 5%
;82;6559357;AXFM;90-9712-18-00;PORTA VERDE ENERGIA  CELULAR FITNESS - T.UNICO-TU;1;$529,90 ;132,48 ;$397,43 ;71,54 ;325,89 ;220;P    Extra Descuento 5%
;82;6559357;ATYM;75-0393-01-02;BOXER BLANCO  SEAMLESS BÁSICO - T.2;2;$449,95 ;179,98 ;$719,92 ;129,59 ;590,33 ;220;P    Oportunidad Boxer Seamless 2x $899.90
;82;6559359;AYCH;3S-0001-01-01;REMERA BLANCO  COMBINADA ELÁSTICO CON TRANSPARENCIA - T.S;1;$659,90 ;0,00 ;$659,90 ;65,99 ;593,91 ;220;PR5  GANGAS DE ENERO  
;82;6564130;AXZC;2N-0504-41-02;REMERA GRIS PLATINO  MANGA COMBINADA CON ESTAMPA RÉFLEX - T.;1;$1.149,90 ;287,48 ;$862,43 ;155,24 ;707,19 ;220;P    Extra Descuento 5%
;549;6559408;AXQJ;07-7038-02-02;CAMPERA NEGRO  BOMBER CINTA SUBLIMADA EN HOMBROS - T.M;1;$1.999,90 ;499,98 ;$1.499,93 ;269,99 ;1229,94 ;220;P    Extra Descuento 5%
;549;6559385;AXPK;03-3028-03-01;PANTALÓN ROJO  CON CINTURA Y RECORTE ENGOMADO - T.S;1;$1.029,90 ;0,00 ;$1.029,90 ;102,99 ;926,91 ;220;PR5  GANGAS DE ENERO  
;549;6559385;AXNC;00-3189-02-02;LEGGING NEGRO  ESTAMPADO CINTURA COMBINADA - T.2;1;$1.589,90 ;0,00 ;$1.589,90 ;158,99 ;1430,91 ;220;PR5  GANGAS DE ENERO  
;549;6559408;AVSL;07-3063-02-03;PANTALON NEGRO  COMBINADO CON ELASTICO CON TRANSPARENCIA Y E;1;$1.499,90 ;374,98 ;$1.124,93 ;202,49 ;922,44 ;220;P    Extra Descuento 5%
;549;6564103;AXXU;24-8013-01-02;TOP BLANCO  CON RECORTE DE MICROTUL AL TONO - T.2;1;$699,90 ;174,98 ;$524,93 ;94,49 ;430,44 ;220;P    Extra Descuento 5%
276;981;6559421;AYNM;67-2180-1D-02;MUSCULOSA AMARILLO NEÓN  CON CUELLO COMBINADO - T.2;1;$749,90 ;224,97 ;$524,93 ;94,49 ;430,44 ;220;P    Extra Descuento 5%
276;981;6559421;ASGP;75-0393-04-03;BOXER AZUL NAVY  SEAMLESS BÁSICO - T.3;1;$449,95 ;112,49 ;$337,46 ;60,74 ;276,72 ;220;P    Oportunidad Boxer Seamless 2x $899.90
276;981;6559421;ATYQ;75-0393-02-03;BOXER NEGRO  SEAMLESS BÁSICO - T.3;1;$449,95 ;112,49 ;$337,46 ;60,74 ;276,72 ;220;P    Oportunidad Boxer Seamless 2x $899.90
276;981;6559421;AYMM;67-2173-02-02;"REMERA NEGRO  SIN MANGAS ""SEE YOU ON THE RUNWAY"" - T.M";1;$919,90 ;275,97 ;$643,93 ;115,91 ;528,02 ;220;P    Extra Descuento 5%
276;981;6559421;AYGH;67-0271-45-02;REMERA VERDE FLUO  BÁSICA - T.M;1;$699,95 ;174,99 ;$524,96 ;94,49 ;430,47 ;220;P    Oportunidad Remera Básica Jersey fine 2X 1399.90
276;981;6559421;ZMOC;91-0810-12-00;MOCHILA PORTA NOTEBOOK;1;$1.399,93 ;0,00 ;$1.399,93 ;139,99 ;1259,94 ;220;P    Free Premiums
276;981;6559421;AYWW;90-9872-02-00;"GORRA NEGRO  ""WILD BRAND"" - T.UNICO-TU";1;$779,94 ;0,00 ;$779,94 ;77,99 ;701,95 ;220;P    Free Premiums
276;981;6559421;AYMK;67-2172-02-03;VESTIDO NEGRO  CON RECORTE COMBINADO EN MICROTUL - T.L;1;$1.049,90 ;314,97 ;$734,93 ;132,29 ;602,64 ;220;P    Extra Descuento 5%
276;981;6559421;AYFF;4P-0016-02-03;REMERA NEGRO  APLIQUE BESO - T.L;1;$1.449,90 ;434,97 ;$1.014,93 ;182,69 ;832,24 ;220;P    Extra Descuento 5%
276;981;6559421;AZBS;67-0271-97-02;REMERA CORAL FLUO  BÁSICA - T.M;1;$699,95 ;174,99 ;$524,96 ;94,49 ;430,47 ;220;P    Oportunidad Remera Básica Jersey fine 2X 1399.90
276;981;6559421;AYND;67-2178-14-01;VESTIDO FRANCIA  CON APLIQUE BOCA - T.S;1;$1.299,90 ;389,97 ;$909,93 ;163,79 ;746,14 ;220;P    Extra Descuento 5%
276;981;6559421;AXRG;0H-5001-02-03;CAPRI NEGRO  BÁSICO - T.3;1;$1.999,90 ;599,97 ;$1.399,93 ;251,99 ;1147,94 ;220;P    Extra Descuento 5%
276;981;6559421;AYCR;3S-9000-01-02;MINIFALDA BLANCO  CRUZADA CON SHORT INTERNO - T.2;1;$1.349,90 ;404,97 ;$944,93 ;170,09 ;774,84 ;220;P    Extra Descuento 5%
276;981;6559421;AXWF;20-2020-02-01;BODY NEGRO  CON VISTA A CONTRATONO - T.1;1;$799,90 ;239,97 ;$559,93 ;100,79 ;459,14 ;220;P    Extra Descuento 5%
276;981;6559421;AYEU;5S-0001-02-02;REMERÓN NEGRO  CON RECORTE ESTAMPADO - T.2;1;$999,90 ;299,97 ;$699,93 ;125,99 ;573,94 ;220;P    Extra Descuento 5%
276;981;6559463;AXQO;07-8022-9A-01;CHALECO NARANJA FLUO  CON APLIQUE DE CINTA Y TAJOS LATERALES;1;$799,90 ;0,00 ;$799,90 ;79,99 ;719,91 ;220;PR5  GANGAS DE ENERO  
276;981;6559463;AXQN;07-7039-1D-03;CAMPERA AMARILLO NEÓN  BOMBER CORTA FRANJA EN MANGA  T.L;1;$1.059,90 ;0,00 ;$1.059,90 ;105,99 ;953,91 ;220;PR5  GANGAS DE ENERO  
276;894;6559455;AYXY;90-5148-01-38;"ZAPATILLA BLANCO  LONA ""VK ALWAYS ON THE RUN"" - T.38";1;$2.799,90 ;279,99 ;$2.519,91 ;251,99 ;2267,92 ;220;P    Calzado
276;894;6559455;AYHN;67-0279-03-02;VESTIDO ROJO  REMERÓN CON TEJIDO EN RUEDO - T.M;1;$1.499,90 ;374,98 ;$1.124,93 ;202,49 ;922,44 ;220;P    Extra Descuento 5%
;925;6559410;AXWF;20-2020-02-01;BODY NEGRO  CON VISTA A CONTRATONO - T.1;1;$559,93 ;0,00 ;$559,93 ;55,99 ;503,94 ;220;P    Free Premiums
;925;6559410;AYMI;67-2172-02-01;VESTIDO NEGRO  CON RECORTE COMBINADO EN MICROTUL - T.S;1;$1.049,90 ;262,48 ;$787,43 ;141,74 ;645,69 ;220;P    Extra Descuento 5%
;925;6559424;AXIQ;07-7037-9A-02;"CAMPERA NARANJA FLUO  CON ESTAMPA EN MANGA ""VK KEEP GOING ON";1;$1.179,90 ;0,00 ;$1.179,90 ;117,99 ;1061,91 ;220;PR5  GANGAS DE ENERO  
;925;6559410;AYUY;70-0186-02-03;VEDETINA NEGRO  DE BAÑO TIRO ALTO - T.3;1;$899,90 ;224,98 ;$674,93 ;121,49 ;553,44 ;220;P    Extra Descuento 5%
;925;6559410;AXVQ;20-2018-13-01;MUSCULOSA AMARILLO  ESCOTE CUADRADO - T.S;1;$899,90 ;224,98 ;$674,93 ;121,49 ;553,44 ;220;P    Extra Descuento 5%
;925;6559410;AYQI;8M-0004-27-02;REMERON GRIS PLOMO  COMBINADO CON CINTA SUBLIMADA - T.M;1;$1.329,90 ;332,48 ;$997,43 ;179,54 ;817,89 ;220;P    Extra Descuento 5%
;925;6559410;AXHT;08-4582-01-03;SHORT BLANCO  BAÑO PRINT HOJAS AZULES - T.L;1;$1.599,90 ;399,98 ;$1.199,93 ;215,99 ;983,94 ;220;P    Extra Descuento 5%
;925;6559410;AYVW;70-0195-90-03;TOP AQUA CLARO  DE BAÑO PRINT FLORES TROPICALES - T.3;1;$1.099,90 ;274,98 ;$824,93 ;148,49 ;676,44 ;220;P    Extra Descuento 5%
276;1022;6559429;AXIW;90-0007-41-00;MOCHILA GRIS PLATINO  DEPORTIVA - T.UNICO-TU;1;$1.979,94 ;0,00 ;$1.979,94 ;197,99 ;1781,95 ;220;P    Free Premiums
276;1022;6559429;AXSG;12-0783-02-03;REMERA NEGRO  DELANTERO SUBLIMADO CON MANGA COMBINADA - T.L;1;$1.329,90 ;332,48 ;$997,43 ;179,54 ;817,89 ;220;P    Extra Descuento 5%
276;1022;6559429;AYLN;67-2171-01-01;MUSCULOSA BLANCO  BÁSICA - T.S;1;$649,95 ;129,99 ;$519,96 ;93,59 ;426,37 ;220;P    Oportunidad Musculosa básica jersey fine 2x1299.90
276;1022;6559429;AXTV;12-2094-02-03;MUSCULOSA NEGRO  CON CINTA SUBLIMADA EN ESPALDA - T.L;1;$949,90 ;237,48 ;$712,43 ;128,24 ;584,19 ;220;P    Extra Descuento 5%
276;1022;6559429;AYAG;2N-4501-27-03;SHORT GRIS PLOMO  COMBINADO CON VIVO A CONTRATONO - T.L;1;$1.149,90 ;287,48 ;$862,43 ;155,24 ;707,19 ;220;P    Extra Descuento 5%
276;1022;6559429;AYWH;90-7268-01-00;SOQUETES BLANCO  PRINT RAYAS COLORES - T.UNICO-TU;1;$269,90 ;67,48 ;$202,43 ;36,44 ;165,99 ;220;P    Extra Descuento 5%
276;1022;6559429;AXRN;0R-2000-02-01;MUSCULOSA NEGRO  ESCOTE HALTER - T.1;1;$799,90 ;199,98 ;$599,93 ;107,99 ;491,94 ;220;P    Extra Descuento 5%
276;1022;6559429;AYLT;67-2171-06-01;MUSCULOSA FUCSIA  BÁSICA - T.S;1;$649,95 ;129,99 ;$519,96 ;93,59 ;426,37 ;220;P    Oportunidad Musculosa básica jersey fine 2x1299.90
276;1022;6559441;AZNS;2N-2505-41-14;MUSCULOSA GRIS PLATINO  NENE DEPORTIVA COMBINADA  - T.14;1;$449,90 ;0,00 ;$449,90 ;44,99 ;404,91 ;220;PR5  GANGAS DE ENERO  
;269;6559286;AQNP;76-4002-02-02;CICLISTA NEGRO  CON RECORTE EN MICROTUL - T.2;1;$1.499,90 ;374,98 ;$1.124,93 ;202,49 ;922,44 ;220;P    Extra Descuento 5%
;269;6559286;AQQA;70-0181-02-02;MALLA NEGRO  ENTERIZA CON VOLADOS - T.2;2;$1.699,90 ;849,95 ;$2.549,85 ;458,97 ;2090,88 ;220;P    Extra Descuento 5%
;269;6559286;AYBU;3Q-2000-02-02;MUSCULOSA NEGRO  CON TAJOS LATERALES - T.M;1;$799,95 ;159,99 ;$639,96 ;115,19 ;524,77 ;220;P    Oportunidad Musculosa Tejido flamé 2x $1599.90
;269;6559286;AYCA;3Q-2000-23-02;MUSCULOSA CORAL  CON TAJOS LATERALES - T.M;1;$799,95 ;159,99 ;$639,96 ;115,19 ;524,77 ;220;P    Oportunidad Musculosa Tejido flamé 2x $1599.90
;0;6559431;AWOY;90-9966-13-00;PORTACELULAR AMARILLO  CON BOQUILLA COMBINADA - T.UNICO-TU;2;$499,90 ;249,95 ;$749,85 ;134,97 ;614,88 ;220;P    Extra Descuento 5%
;0;6564951;ATWS;67-2157-03-01;"MUSCULOSA ROJO  CON ESTAMPA ""CHANGE"" - T.S";1;$0,01 ;0,00 ;$0,01 ;0,00 ;0,01 ;220;PR4  ACS EXCLUSIVOS - CADA 200 UNIDADES  
;0;6564954;AULI;67-0248-36-02;REMERA VERDE ESMERALDA  DEPORTIVA CON ELÁSTICO EN ESPALDA - ;1;$0,01 ;0,00 ;$0,01 ;0,00 ;0,01 ;220;PR4  ACS EXCLUSIVOS - CADA 200 UNIDADES  
;0;6564114;ZLOL;91-0555-00-00;BOLIGRAFO LOLIPOP VK (Pack x 10 unidades);2;$199,90 ;0,00 ;$399,80 ;0,00 ;399,80 ;220;P    
;0;6564951;APTB;15-3015-02-01;BABUCHA NEGRO  CON DETALLE DE CIERRES - T.S;1;$0,01 ;0,00 ;$0,01 ;0,00 ;0,01 ;220;PR4  ACS EXCLUSIVOS - CADA 200 UNIDADES  
;0;6564951;AUBN;07-8021-03-02;SUDADERA ROJO  DEPORTIVA CON CINTA LATERAL ESTAMPADA - T.M;1;$0,01 ;0,00 ;$0,01 ;0,00 ;0,01 ;220;PR4  ACS EXCLUSIVOS - CADA 200 UNIDADES  
;694;6559411;AYNJ;67-2180-97-01;MUSCULOSA CORAL FLUO  CON CUELLO COMBINADO - T.1;1;$749,90 ;187,48 ;$562,43 ;101,24 ;461,19 ;220;P    Extra Descuento 5%
;902;6559393;AUIM;4B-4016-02-02;SHORT NEGRO  COMBINADO CON POWER SOFT SILVER - T.M;1;$1.299,90 ;324,98 ;$974,93 ;175,49 ;799,44 ;220;P    Extra Descuento 5%
;751;6559403;AYKN;67-0665-72-04;REMERA GRIS MELANGE OSCURO  COLOR-BLOCK CON ESTAMPA EN RECOR;1;$1.149,90 ;287,48 ;$862,43 ;155,24 ;707,19 ;220;P    Extra Descuento 5%
;751;6559403;AYNE;67-2178-14-02;VESTIDO FRANCIA  CON APLIQUE BOCA - T.M;1;$1.299,90 ;324,98 ;$974,93 ;175,49 ;799,44 ;220;P    Extra Descuento 5%
;751;6559403;AOZN;81-3501-02-04;BABUCHA NEGRO  CORTE JEAN - T.XL;1;$2.199,90 ;549,98 ;$1.649,93 ;296,99 ;1352,94 ;220;P    Extra Descuento 5%
;751;6559403;AZBG;90-5654-27-44;OJOTAS GRIS PLOMO  PRINT CAMUFLADO - T.44-45;1;$1.099,90 ;109,99 ;$989,91 ;98,99 ;890,92 ;220;P    Calzado
;878;6559300;AYJN;67-0659-03-02;"REMERA ROJO  ""I´M THE PERFECT..."" - T.M";1;$699,93 ;0,00 ;$699,93 ;69,99 ;629,94 ;220;P    Free Premiums
;878;6559300;AYWJ;90-7270-09-00;PACK TURQUESA  X2 SOQUETES COLOR-BLOCK CON ESTRELLAS - T.UNI;1;$469,90 ;117,48 ;$352,43 ;63,44 ;288,99 ;220;P    Extra Descuento 5%
;878;6559300;AUHN;3N-3502-72-02;PANTALON GRIS MELANGE OSCURO  CON CARTERA Y TIRA LATERAL - T;1;$1.699,90 ;424,98 ;$1.274,93 ;229,49 ;1045,44 ;220;P    Extra Descuento 5%
;878;6559300;AYEB;5K-4504-72-02;BERMUDA GRIS MELANGE OSCURO  CON CINTA SUBLIMADA NEGRA - T.M;1;$1.549,90 ;387,48 ;$1.162,43 ;209,24 ;953,19 ;220;P    Extra Descuento 5%
;878;6559300;AYRO;75-0457-02-04;CULOTTELESS NEGRO  ALTO CON PUNTILLA - T.4;2;$319,95 ;127,98 ;$511,92 ;92,15 ;419,77 ;220;P    Oportunidad Bombachas2 _ 2X $639.90
;878;6559300;AXOR;03-0892-04-01;"REMERA AZUL NAVY  COLOR-BLOCK ""VK NO LIMITS"" - T.S";1;$1.099,90 ;274,98 ;$824,93 ;148,49 ;676,44 ;220;P    Extra Descuento 5%
;878;6559336;AXQF;07-6060-01-01;BUZO BLANCO  SUBLIMADO ACEBRADO - T.S;1;$929,90 ;0,00 ;$929,90 ;92,99 ;836,91 ;220;PR5  GANGAS DE ENERO  
901;1006;6559392;AZBM;90-7286-01-00;SOQUETE BLANCO  INVISIBLE RAYAS MULTICOLOR EN PUNTA - T.UNIC;2;$234,95 ;93,98 ;$375,92 ;67,67 ;308,25 ;220;P    Oportunidad Socks invisible Multirayas 2X $469.90
901;1006;6559392;AYBZ;3Q-2000-23-01;MUSCULOSA CORAL  CON TAJOS LATERALES - T.S;1;$799,95 ;159,99 ;$639,96 ;115,19 ;524,77 ;220;P    Oportunidad Musculosa Tejido flamé 2x $1599.90
901;1006;6559392;AYET;5S-0001-02-01;REMERÓN NEGRO  CON RECORTE ESTAMPADO - T.1;1;$999,90 ;249,98 ;$749,93 ;134,99 ;614,94 ;220;P    Extra Descuento 5%
