901;1006;6559392;AQNQ;76-4002-02-03;CICLISTA NEGRO  CON RECORTE EN MICROTUL - T.3;1;$1.499,90 ;374,98 ;$1.124,93 ;202,49 ;922,44 ;220;P    Extra Descuento 5%
901;1006;6559392;AYBX;3Q-2000-11-02;MUSCULOSA CELESTE  CON TAJOS LATERALES - T.M;1;$799,95 ;159,99 ;$639,96 ;115,19 ;524,77 ;220;P    Oportunidad Musculosa Tejido flamé 2x $1599.90
901;1006;6559392;AOUN;6C-0001-01-01;REMERA BLANCO  CON TAJOS LATERALES - T.S;1;$599,94 ;0,00 ;$599,94 ;59,99 ;539,95 ;220;P    Free Premiums
901;1006;6559392;AQQA;70-0181-02-02;MALLA NEGRO  ENTERIZA CON VOLADOS - T.2;1;$1.699,90 ;424,98 ;$1.274,93 ;229,49 ;1045,44 ;220;P    Extra Descuento 5%
;1013;6559369;AQPZ;70-0181-02-01;MALLA NEGRO  ENTERIZA CON VOLADOS - T.1;1;$1.699,90 ;424,98 ;$1.274,93 ;229,49 ;1045,44 ;220;P    Extra Descuento 5%
;1013;6559369;AYCQ;3S-9000-01-01;MINIFALDA BLANCO  CRUZADA CON SHORT INTERNO - T.1;1;$1.349,90 ;337,48 ;$1.012,43 ;182,24 ;830,19 ;220;P    Extra Descuento 5%
;1013;6559369;AXPV;07-3067-02-03;PANTALON NEGRO  CROPPED CINTURA ELÁSTICA CON LOGO - T.L;1;$1.099,90 ;274,98 ;$824,93 ;148,49 ;676,44 ;220;P    Extra Descuento 5%
;1013;6559370;AXXY;24-8014-02-02;TOP NEGRO  HOMBRO ELÁSTICO CON LOGO - T.2;1;$549,90 ;0,00 ;$549,90 ;54,99 ;494,91 ;220;PR5  GANGAS DE ENERO  
;1013;6559369;AYLF;67-2168-01-02;"REMERA BLANCO  SIN MANGAS ""FEELING GOOD..."" - T.M";1;$999,90 ;249,98 ;$749,93 ;134,99 ;614,94 ;220;P    Extra Descuento 5%
;1013;6559369;AYEX;60-3025-27-01;LEGGING GRIS PLOMO  ESTAMPADO ACEBRADO  - T.1;1;$959,94 ;0,00 ;$959,94 ;95,99 ;863,95 ;220;P    Free Premiums
;1013;6559369;AYNE;67-2178-14-02;VESTIDO FRANCIA  CON APLIQUE BOCA - T.M;1;$1.299,90 ;324,98 ;$974,93 ;175,49 ;799,44 ;220;P    Extra Descuento 5%
;1013;6559370;AXQF;07-6060-01-01;BUZO BLANCO  SUBLIMADO ACEBRADO - T.S;1;$929,90 ;0,00 ;$929,90 ;92,99 ;836,91 ;220;PR5  GANGAS DE ENERO  
;1013;6559369;AYQX;90-0015-9A-00;CUELLO NARANJA FLUO  PRINT BATIK VK NO LIMITS - T.UNICO-TU;1;$399,90 ;99,98 ;$299,93 ;53,99 ;245,94 ;220;P    Extra Descuento 5%
;1013;6559369;AUIL;4B-4016-02-01;SHORT NEGRO  COMBINADO CON POWER SOFT SILVER - T.S;1;$1.299,90 ;324,98 ;$974,93 ;175,49 ;799,44 ;220;P    Extra Descuento 5%
;1013;6564052;APKP;6C-2001-02-02;MUSCULOSA NEGRO  CON TAJOS LATERALES - T.M;1;$899,90 ;224,98 ;$674,93 ;121,49 ;553,44 ;220;P    Extra Descuento 5%
;796;6559345;AIAQ;90-7170-01-00;MEDIAS BLANCO  3/4 BÁSICAS - T.UNICO;1;$299,95 ;59,99 ;$239,96 ;43,19 ;196,77 ;220;P    Oportunidad Media 3/4 Hombre 2x $599.90
;796;6559345;AYTU;75-0476-3A-03;MUSCULOSA CORAL MELANGE  LENCERA COMBINADA - T.3;1;$699,90 ;174,98 ;$524,93 ;94,49 ;430,44 ;220;P    Extra Descuento 5%
;796;6559345;AYIL;67-0652-01-02;"REMERA BLANCO  ""NON TI PREOCCUPARE"" - T.M";1;$999,90 ;249,98 ;$749,93 ;134,99 ;614,94 ;220;P    Extra Descuento 5%
;796;6559345;AYXD;03-0135-1A-01;MINIVESTIDO MOSTAZA  CON CHARRETERAS - T.1;1;$1.199,90 ;299,98 ;$899,93 ;161,99 ;737,94 ;220;P    Extra Descuento 5%
;796;6559345;AIAS;90-7170-12-00;MEDIAS GRIS MELANGE  3/4 BÁSICAS - T.UNICO;1;$299,95 ;59,99 ;$239,96 ;43,19 ;196,77 ;220;P    Oportunidad Media 3/4 Hombre 2x $599.90
;796;6559345;AXIO;08-4589-02-03;SHORT NEGRO  DE BAÑO LISO CON ESTAMPA - T.L;1;$1.499,90 ;374,98 ;$1.124,93 ;202,49 ;922,44 ;220;P    Extra Descuento 5%
;796;6559345;AXPP;03-4025-02-03;SHORT NEGRO  CON BOLSILLOS PLAQUÉ - T.L;1;$1.149,90 ;287,48 ;$862,43 ;155,24 ;707,19 ;220;P    Extra Descuento 5%
;796;6559355;AXOX;03-2025-02-03;VESTIDO NEGRO  CAMISERO CON LAZO - T.L;1;$1.399,90 ;0,00 ;$1.399,90 ;139,99 ;1259,91 ;220;PR5  GANGAS DE ENERO  
;796;6559355;AYBC;3N-4500-13-02;BERMUDA AMARILLO  CON GALÓN LATERAL - T.M;1;$929,90 ;0,00 ;$929,90 ;92,99 ;836,91 ;220;PR5  GANGAS DE ENERO  
;796;6559355;AYFR;62-0516-02-02;CHOMBA NEGRO  CARTERA COMBINADA - T.M;1;$899,90 ;0,00 ;$899,90 ;89,99 ;809,91 ;220;PR5  GANGAS DE ENERO  
;796;6559355;ALLZ;6H-2000-36-03;MUSCULOSA VERDE ESMERALDA  CON ESPALDA CAVADA - T.L;1;$449,90 ;0,00 ;$449,90 ;44,99 ;404,91 ;220;PR5  GANGAS DE ENERO  
;796;6564090;AYCM;3S-0001-33-03;REMERA LIMÓN  COMBINADA ELÁSTICO CON TRANSPARENCIA - T.L;1;$899,90 ;224,98 ;$674,93 ;121,49 ;553,44 ;220;P    Extra Descuento 5%
;939;6559329;AYLM;67-2170-01-03;"MUSCULOSA BLANCO  ""SAVAGE SIDE"" - T.L";1;$899,90 ;224,98 ;$674,93 ;121,49 ;553,44 ;220;P    Extra Descuento 5%
;939;6559329;AYSR;75-0467-12-02;CULOTTELESS GRIS MELANGE  HIPSTER CON PUNTILLAS - T.2;1;$419,90 ;104,98 ;$314,93 ;56,69 ;258,24 ;220;P    Extra Descuento 5%
;939;6559329;AXJX;15-3023-03-03;PALAZZO ROJO  CON LAZO EN CINTURA - T.L;1;$1.499,90 ;374,98 ;$1.124,93 ;202,49 ;922,44 ;220;P    Extra Descuento 5%
;939;6559329;AXPP;03-4025-02-03;SHORT NEGRO  CON BOLSILLOS PLAQUÉ - T.L;1;$1.149,90 ;287,48 ;$862,43 ;155,24 ;707,19 ;220;P    Extra Descuento 5%
;939;6559329;AXIX;90-0007-81-00;MOCHILA VERDE LIMA  DEPORTIVA - T.UNICO-TU;1;$1.979,94 ;0,00 ;$1.979,94 ;197,99 ;1781,95 ;220;P    Free Premiums
;939;6559329;AYPN;7T-0001-22-00;TÚNICA CRUDO  PRINT ACEBRADO CON VISTA - T.UNICO-TU;1;$1.599,90 ;399,98 ;$1.199,93 ;215,99 ;983,94 ;220;P    Extra Descuento 5%
;939;6559329;AYTY;70-0098-02-04;CULOTTE NEGRO  DE BAÑO TIRO ALTO - T.4;1;$949,90 ;237,48 ;$712,43 ;128,24 ;584,19 ;220;P    Extra Descuento 5%
;939;6559329;AYWI;90-7269-12-00;PACK GRIS MELANGE  X2 SOQUETES PRINT ESTRELLAS FLÚO - T.UNIC;1;$469,90 ;117,48 ;$352,43 ;63,44 ;288,99 ;220;P    Extra Descuento 5%
;939;6559360;AYBQ;3Q-0006-02-01;REMERA NEGRO  CON TAJO EN MANGAS Y ESTAMPA SERPIENTE - T.S;2;$799,90 ;0,00 ;$1.599,80 ;159,98 ;1439,82 ;220;PR5  GANGAS DE ENERO  
;939;6559360;ANAM;70-0165-02-01;CORPIÑO NEGRO  DE BAÑO TORZADO CON DETALLE ESTAMPADO - T.1;1;$399,90 ;0,00 ;$399,90 ;39,99 ;359,91 ;220;PR5  GANGAS DE ENERO  
;939;6559360;ALNT;15-3011-29-01;PANTALÓN PETROLEO  CORTE OXFORD - T.S;1;$799,90 ;0,00 ;$799,90 ;79,99 ;719,91 ;220;PR5  GANGAS DE ENERO  
;823;6559402;AXIO;08-4589-02-03;SHORT NEGRO  DE BAÑO LISO CON ESTAMPA - T.L;1;$1.499,90 ;374,98 ;$1.124,93 ;202,49 ;922,44 ;220;P    Extra Descuento 5%
;823;6559402;AXZH;2N-0505-45-03;REMERA VERDE FLUO  DEPORTIVA COMBINADA DETALLE RÉFLEX - T.L;1;$859,90 ;214,98 ;$644,93 ;116,09 ;528,84 ;220;P    Extra Descuento 5%
;914;6564069;AYBR;3Q-0006-02-02;REMERA NEGRO  CON TAJO EN MANGAS Y ESTAMPA SERPIENTE - T.M;1;$799,90 ;0,00 ;$799,90 ;79,99 ;719,91 ;220;PR5  GANGAS DE ENERO  
;914;6564069;AXVK;20-0006-06-01;REMERA FUCSIA  GOTA CALADA - T.S;1;$589,90 ;0,00 ;$589,90 ;58,99 ;530,91 ;220;PR5  GANGAS DE ENERO  
;914;6564069;AXNF;00-3191-41-01;LEGGING GRIS PLATINO  PRINT HOJAS - T.1;1;$1.589,90 ;0,00 ;$1.589,90 ;158,99 ;1430,91 ;220;PR5  GANGAS DE ENERO  
;914;6564073;AXSO;12-0785-02-03;REMERA NEGRO  COMBINADA ESTAMPA VKX - T.L;1;$1.259,90 ;314,98 ;$944,93 ;170,09 ;774,84 ;220;P    Extra Descuento 5%
;914;6564069;AOVR;8K-2000-02-01;MUSCULOSA NEGRO  ESPALDA CAVADA - T.1;1;$449,90 ;0,00 ;$449,90 ;44,99 ;404,91 ;220;PR5  GANGAS DE ENERO  
;914;6564073;ZLOL;91-0555-00-00;BOLIGRAFO LOLIPOP VK (Pack x 10 unidades);1;$199,90 ;0,00 ;$199,90 ;0,00 ;199,90 ;220;P    
;914;6564069;AROC;00-5666-02-01;CAPRI NEGRO  CON SHORT COMBINADO SUPERPUESTO - T.1;1;$689,90 ;0,00 ;$689,90 ;68,99 ;620,91 ;220;PR5  GANGAS DE ENERO  
;1021;6559380;AXTU;12-2094-02-02;MUSCULOSA NEGRO  CON CINTA SUBLIMADA EN ESPALDA - T.M;1;$949,90 ;284,97 ;$664,93 ;119,69 ;545,24 ;220;P    Extra Descuento 5%
;1021;6559397;AXQN;07-7039-1D-03;CAMPERA AMARILLO NEÓN  BOMBER CORTA FRANJA EN MANGA  T.L;1;$1.059,90 ;0,00 ;$1.059,90 ;105,99 ;953,91 ;220;PR5  GANGAS DE ENERO  
;1021;6559380;AXQB;07-4033-9A-03;SHORT NARANJA FLUO  DEPORTIVO COMBINADO - T.L;1;$759,90 ;227,97 ;$531,93 ;95,75 ;436,18 ;220;P    Extra Descuento 5%
;1021;6559380;AYBJ;3Q-0005-03-03;REMERA ROJO  CON TEJIDO EN CUELLO - T.L;1;$899,95 ;224,99 ;$674,96 ;121,49 ;553,47 ;220;P    Oportunidad Remera Tejido flamé con cuello tejido 2x$1799.90
;1021;6559397;AXWE;20-2019-85-03;MUSCULOSA MANDARINA  COLOR-BLOCK - T.L;1;$589,90 ;0,00 ;$589,90 ;58,99 ;530,91 ;220;PR5  GANGAS DE ENERO  
;1021;6559380;AXVO;20-2018-02-02;MUSCULOSA NEGRO  ESCOTE CUADRADO - T.M;1;$899,90 ;269,97 ;$629,93 ;113,39 ;516,54 ;220;P    Extra Descuento 5%
;1021;6559380;AXXK;24-5026-14-03;CAPRI FRANCIA  CON ELÁSTICO CON LOGO - T.3;1;$909,93 ;0,00 ;$909,93 ;90,99 ;818,94 ;220;P    Free Premiums
;1021;6559380;AYPP;81-4031-01-02;SHORT BLANCO  CON RED SUPERPUESTA EN LATERAL - T.M;1;$1.149,90 ;344,97 ;$804,93 ;144,89 ;660,04 ;220;P    Extra Descuento 5%
;1021;6559397;APHU;00-5653-02-03;CAPRI NEGRO  CON TIRAS LATERALES - T.3;1;$689,90 ;0,00 ;$689,90 ;68,99 ;620,91 ;220;PR5  GANGAS DE ENERO  
;1021;6559380;AYFC;60-8004-02-02;TOP NEGRO  ESCOTE HALTER - T.2;1;$699,90 ;209,97 ;$489,93 ;88,19 ;401,74 ;220;P    Extra Descuento 5%
;1021;6559380;AYUD;12-2096-9A-02;MUSCULOSA NARANJA FLUO  CON CINTA SUBLIMADA EN ESPALDA - T.M;1;$949,90 ;284,97 ;$664,93 ;119,69 ;545,24 ;220;P    Extra Descuento 5%
;1021;6559380;AYBP;3Q-0005-1A-03;REMERA MOSTAZA  CON TEJIDO EN CUELLO - T.L;1;$899,95 ;224,99 ;$674,96 ;121,49 ;553,47 ;220;P    Oportunidad Remera Tejido flamé con cuello tejido 2x$1799.90
;1021;6559380;AYHC;67-0276-02-03;VESTIDO NEGRO  CON GALÓN - T.L;1;$1.099,90 ;329,97 ;$769,93 ;138,59 ;631,34 ;220;P    Extra Descuento 5%
;1021;6559380;AYNU;6F-2003-02-02;VESTIDO NEGRO  CON VISTA COMBINADA - T.M;1;$1.599,90 ;479,97 ;$1.119,93 ;201,59 ;918,34 ;220;P    Extra Descuento 5%
;1021;6559380;AXVI;20-0005-02-02;REMERA NEGRO  BICOLOR CON ABERTURA EN MANGAS - T.M;1;$580,93 ;0,00 ;$580,93 ;58,09 ;522,84 ;220;P    Free Premiums
;1021;6559397;AXIR;07-7037-9A-03;"CAMPERA NARANJA FLUO  CON ESTAMPA EN MANGA ""VK KEEP GOING ON";1;$1.179,90 ;0,00 ;$1.179,90 ;117,99 ;1061,91 ;220;PR5  GANGAS DE ENERO  
;139;6559342;APKQ;6C-2001-02-03;MUSCULOSA NEGRO  CON TAJOS LATERALES - T.L;1;$849,95 ;212,49 ;$637,46 ;114,74 ;522,72 ;220;P    Oportunidad Musculosa Power soft 2x $1699.90
;139;6559342;BAXG;56-2047-78-02;VESTIDO ROSA  ANIMAL PRINT CON DETALLE DE TUL EN DELANTERO  ;1;$1.299,90 ;389,97 ;$909,93 ;163,79 ;746,14 ;220;P    Extra Descuento 5%
;139;6559342;AXTS;12-2093-02-03;"MUSCULOSA NEGRO  SUBLIMADO BATIK ""VK NO LIMITS"" - T.L";1;$1.149,90 ;344,97 ;$804,93 ;144,89 ;660,04 ;220;P    Extra Descuento 5%
;139;6559342;AYNE;67-2178-14-02;VESTIDO FRANCIA  CON APLIQUE BOCA - T.M;2;$1.299,90 ;779,94 ;$1.819,86 ;327,57 ;1492,29 ;220;P    Extra Descuento 5%
;139;6559342;AYCG;3Q-7000-1A-00;KIMONO MOSTAZA  BÁSICO - T.UNICO-TU;1;$1.499,90 ;449,97 ;$1.049,93 ;188,99 ;860,94 ;220;P    Extra Descuento 5%
;139;6559342;BAXF;56-2047-78-01;VESTIDO ROSA  ANIMAL PRINT CON DETALLE DE TUL EN DELANTERO  ;1;$1.299,90 ;389,97 ;$909,93 ;163,79 ;746,14 ;220;P    Extra Descuento 5%
;139;6559342;AYNF;67-2178-14-03;VESTIDO FRANCIA  CON APLIQUE BOCA - T.L;1;$1.299,90 ;389,97 ;$909,93 ;163,79 ;746,14 ;220;P    Extra Descuento 5%
;139;6559342;APKN;6C-2001-01-03;MUSCULOSA BLANCO  CON TAJOS LATERALES - T.L;1;$849,95 ;212,49 ;$637,46 ;114,74 ;522,72 ;220;P    Oportunidad Musculosa Power soft 2x $1699.90
;139;6559342;AYCR;3S-9000-01-02;MINIFALDA BLANCO  CRUZADA CON SHORT INTERNO - T.2;1;$1.349,90 ;404,97 ;$944,93 ;170,09 ;774,84 ;220;P    Extra Descuento 5%
;139;6559342;AYFN;62-0515-01-02;"REMERA BLANCO  ""CHOOSE YOUR ADVENTURE"" - T.M";1;$1.249,90 ;374,97 ;$874,93 ;157,49 ;717,44 ;220;P    Extra Descuento 5%
;139;6564110;AXOW;03-2025-02-02;VESTIDO NEGRO  CAMISERO CON LAZO - T.M;1;$1.399,90 ;0,00 ;$1.399,90 ;139,99 ;1259,91 ;220;PR5  GANGAS DE ENERO  
276;975;6559416;AXPW;07-4032-02-01;SHORT NEGRO  COMBINADO CON CINTA SUBLIMADA - T.S;1;$899,90 ;269,97 ;$629,93 ;113,39 ;516,54 ;220;P    Extra Descuento 5%
276;975;6559416;ASGS;75-0393-31-03;BOXER BORDEAUX  SEAMLESS BÁSICO - T.3;1;$449,95 ;112,49 ;$337,46 ;60,74 ;276,72 ;220;P    Oportunidad Boxer Seamless 2x $899.90
276;975;6559416;AYHE;67-0277-02-02;REMERA NEGRO  CON RECORTE DE MICROTUL - T.M;1;$799,90 ;239,97 ;$559,93 ;100,79 ;459,14 ;220;P    Extra Descuento 5%
276;975;6559416;ASGP;75-0393-04-03;BOXER AZUL NAVY  SEAMLESS BÁSICO - T.3;1;$449,95 ;112,49 ;$337,46 ;60,74 ;276,72 ;220;P    Oportunidad Boxer Seamless 2x $899.90
276;975;6559416;AYFC;60-8004-02-02;TOP NEGRO  ESCOTE HALTER - T.2;1;$489,93 ;0,00 ;$489,93 ;48,99 ;440,94 ;220;P    Free Premiums
276;975;6559416;AUQT;89-4001-02-01;SHORT NEGRO  CORTE JEAN - T.S;1;$1.459,90 ;437,97 ;$1.021,93 ;183,95 ;837,98 ;220;P    Extra Descuento 5%
276;975;6559416;AUIM;4B-4016-02-02;SHORT NEGRO  COMBINADO CON POWER SOFT SILVER - T.M;1;$1.299,90 ;389,97 ;$909,93 ;163,79 ;746,14 ;220;P    Extra Descuento 5%
276;975;6559416;AYOX;74-0502-1C-04;"REMERA BEIGE  ""GREAT THINGS..."" - T.XL";1;$949,90 ;284,97 ;$664,93 ;119,69 ;545,24 ;220;P    Extra Descuento 5%
276;975;6559416;AYEY;60-3025-27-02;LEGGING GRIS PLOMO  ESTAMPADO ACEBRADO  - T.2;1;$959,94 ;0,00 ;$959,94 ;95,99 ;863,95 ;220;P    Free Premiums
276;975;6559416;AUHO;3N-3502-72-03;PANTALON GRIS MELANGE OSCURO  CON CARTERA Y TIRA LATERAL - T;1;$1.699,90 ;509,97 ;$1.189,93 ;214,19 ;975,74 ;220;P    Extra Descuento 5%
276;975;6559416;AYET;5S-0001-02-01;REMERÓN NEGRO  CON RECORTE ESTAMPADO - T.1;2;$999,90 ;599,94 ;$1.399,86 ;251,97 ;1147,89 ;220;P    Extra Descuento 5%
276;975;6559416;AXJX;15-3023-03-03;PALAZZO ROJO  CON LAZO EN CINTURA - T.L;1;$1.499,90 ;449,97 ;$1.049,93 ;188,99 ;860,94 ;220;P    Extra Descuento 5%
276;975;6559462;AZAE;90-5155-90-36;OJOTAS AQUA CLARO  PRINT TROPICAL - T.36-37;1;$679,90 ;0,00 ;$679,90 ;67,99 ;611,91 ;220;PR5  GANGAS DE ENERO  
;288;6559400;AUHX;3Q-0001-02-03;REMERA NEGRO  CON ATRAQUES EN MANGAS - T.L;1;$999,90 ;249,98 ;$749,93 ;134,99 ;614,94 ;220;P    Extra Descuento 5%
;288;6559400;AUVZ;70-5019-02-02;CORPIÑO NEGRO  DE BAÑO TRIÁNGULO  - T.2;1;$849,90 ;212,48 ;$637,43 ;114,74 ;522,69 ;220;P    Extra Descuento 5%
;288;6559400;AYBJ;3Q-0005-03-03;REMERA ROJO  CON TEJIDO EN CUELLO - T.L;1;$1.099,90 ;274,98 ;$824,93 ;148,49 ;676,44 ;220;P    Extra Descuento 5%
;288;6559400;AYHC;67-0276-02-03;VESTIDO NEGRO  CON GALÓN - T.L;1;$1.099,90 ;274,98 ;$824,93 ;148,49 ;676,44 ;220;P    Extra Descuento 5%
;90;6564117;BAXG;56-2047-78-02;VESTIDO ROSA  ANIMAL PRINT CON DETALLE DE TUL EN DELANTERO  ;1;$1.299,90 ;324,98 ;$974,93 ;175,49 ;799,44 ;220;P    Extra Descuento 5%
;90;6564122;AOVR;8K-2000-02-01;MUSCULOSA NEGRO  ESPALDA CAVADA - T.1;1;$449,90 ;0,00 ;$449,90 ;44,99 ;404,91 ;220;PR5  GANGAS DE ENERO  
;90;6564117;AYMJ;67-2172-02-02;VESTIDO NEGRO  CON RECORTE COMBINADO EN MICROTUL - T.M;1;$1.049,90 ;262,48 ;$787,43 ;141,74 ;645,69 ;220;P    Extra Descuento 5%
;811;6559340;AJLA;90-7179-02-00;SOQUETE NEGRO  BÁSICO - T.UNICO;1;$216,63 ;43,33 ;$173,31 ;31,20 ;142,11 ;220;P    Oportunidad Socks algodón Hombre 3x $649.90  
;811;6559340;ASGP;75-0393-04-03;BOXER AZUL NAVY  SEAMLESS BÁSICO - T.3;1;$499,90 ;124,98 ;$374,93 ;67,49 ;307,44 ;220;P    Extra Descuento 5%
;811;6559340;AJLB;90-7179-12-00;SOQUETE GRIS MELANGE  BÁSICO - T.UNICO;1;$216,63 ;43,33 ;$173,31 ;31,20 ;142,11 ;220;P    Oportunidad Socks algodón Hombre 3x $649.90  
;811;6559340;APKO;6C-2001-02-01;MUSCULOSA NEGRO  CON TAJOS LATERALES - T.S;1;$899,90 ;224,98 ;$674,93 ;121,49 ;553,44 ;220;P    Extra Descuento 5%
;811;6559340;AWOC;81-9001-02-01;MINIFALDA NEGRO  PORTAFOLIO - T.1;1;$1.259,90 ;314,98 ;$944,93 ;170,09 ;774,84 ;220;P    Extra Descuento 5%
;811;6559340;AXVN;20-2018-02-01;MUSCULOSA NEGRO  ESCOTE CUADRADO - T.S;1;$899,90 ;224,98 ;$674,93 ;121,49 ;553,44 ;220;P    Extra Descuento 5%
;811;6559340;AJKZ;90-7179-01-00;SOQUETE BLANCO  BÁSICO - T.UNICO;1;$216,63 ;43,33 ;$173,31 ;31,20 ;142,11 ;220;P    Oportunidad Socks algodón Hombre 3x $649.90  
;811;6559340;AWLO;75-0448-01-02;COLALESS BLANCO  ELASTICO CON LUREX - T.2;1;$329,90 ;82,48 ;$247,43 ;44,54 ;202,89 ;220;P    Extra Descuento 5%
;811;6559354;AYFR;62-0516-02-02;CHOMBA NEGRO  CARTERA COMBINADA - T.M;1;$899,90 ;0,00 ;$899,90 ;89,99 ;809,91 ;220;PR5  GANGAS DE ENERO  
;811;6559354;AYBC;3N-4500-13-02;BERMUDA AMARILLO  CON GALÓN LATERAL - T.M;1;$929,90 ;0,00 ;$929,90 ;92,99 ;836,91 ;220;PR5  GANGAS DE ENERO  
;811;6559354;APHR;00-4027-25-02;CICLISTA PLATEADO  CON RECORTES EN MICROTUL - T.2;1;$689,90 ;0,00 ;$689,90 ;68,99 ;620,91 ;220;PR5  GANGAS DE ENERO  
;989;6559323;AHZZ;90-7157-01-00;SOQUETE BLANCO  BÁSICO CON DETALLE EN RED - T.UNICO;1;$269,90 ;80,97 ;$188,93 ;34,01 ;154,92 ;220;P    Extra Descuento 5%
;989;6559323;ATBL;90-7248-12-00;SOQUETE GRIS MELANGE  INVISIBLE DOBLE LÍNEA - T.UNICO-TU;1;$234,95 ;58,74 ;$176,21 ;31,72 ;144,49 ;220;P    Oportunidad Soquete Invisible algodón Mujer 2X $469.90
;989;6559323;ATBJ;90-7248-01-00;SOQUETE BLANCO  INVISIBLE DOBLE LÍNEA - T.UNICO-TU;1;$234,95 ;58,74 ;$176,21 ;31,72 ;144,49 ;220;P    Oportunidad Soquete Invisible algodón Mujer 2X $469.90
;989;6559323;AXJX;15-3023-03-03;PALAZZO ROJO  CON LAZO EN CINTURA - T.L;1;$1.499,90 ;449,97 ;$1.049,93 ;188,99 ;860,94 ;220;P    Extra Descuento 5%
;989;6559323;ASGR;75-0393-31-02;BOXER BORDEAUX  SEAMLESS BÁSICO - T.2;1;$499,90 ;149,97 ;$349,93 ;62,99 ;286,94 ;220;P    Extra Descuento 5%
;989;6559323;AMZP;90-7199-12-00;SOQUETE GRIS MELANGE  INVISIBLE - T.UNICO;1;$269,90 ;80,97 ;$188,93 ;34,01 ;154,92 ;220;P    Extra Descuento 5%
;989;6559323;ZMOC;91-0810-12-00;MOCHILA PORTA NOTEBOOK;1;$1.399,93 ;0,00 ;$1.399,93 ;139,99 ;1259,94 ;220;P    Free Premiums
;989;6559323;AXXK;24-5026-14-03;CAPRI FRANCIA  CON ELÁSTICO CON LOGO - T.3;1;$1.299,90 ;389,97 ;$909,93 ;163,79 ;746,14 ;220;P    Extra Descuento 5%
;989;6559323;AYPB;75-0393-36-01;BOXER VERDE ESMERALDA  SEAMLESS BÁSICO - T.1;1;$449,95 ;112,49 ;$337,46 ;60,74 ;276,72 ;220;P    Oportunidad Boxer Seamless 2x $899.90
;989;6559323;AYHM;67-0279-03-01;VESTIDO ROJO  REMERÓN CON TEJIDO EN RUEDO - T.S;1;$1.499,90 ;449,97 ;$1.049,93 ;188,99 ;860,94 ;220;P    Extra Descuento 5%
;989;6559323;AXVP;20-2018-02-03;MUSCULOSA NEGRO  ESCOTE CUADRADO - T.L;1;$899,90 ;269,97 ;$629,93 ;113,39 ;516,54 ;220;P    Extra Descuento 5%
;989;6559323;AYOY;75-0393-03-01;BOXER ROJO  SEAMLESS BÁSICO - T.1;1;$449,95 ;112,49 ;$337,46 ;60,74 ;276,72 ;220;P    Oportunidad Boxer Seamless 2x $899.90
;989;6559374;AWIY;75-0425-20-03;TOP CAMEL  DEPORTIVO ESTAMPADO ANIMAL PRINT - T.3;1;$499,90 ;0,00 ;$499,90 ;49,99 ;449,91 ;220;PR5  GANGAS DE ENERO  
;989;6564066;AXJL;3Q-0001-11-03;REMERA CELESTE  CON ATRAQUES EN MANGAS - T.L;1;$899,95 ;224,99 ;$674,96 ;121,49 ;553,47 ;220;P    Oportunidad Remera Flamé 2x $1799.9
;989;6564066;AXJO;3Q-0001-23-03;REMERA CORAL  CON ATRAQUES EN MANGAS - T.L;1;$899,95 ;224,99 ;$674,96 ;121,49 ;553,47 ;220;P    Oportunidad Remera Flamé 2x $1799.9
276;665;6564104;AWKT;75-0441-02-02;COLALESS NEGRO  ELASTICO CON LÙREX - T.2;1;$329,90 ;82,48 ;$247,43 ;44,54 ;202,89 ;220;P    Extra Descuento 5%
276;665;6564104;AYSO;75-0466-72-02;TOP GRIS MELANGE OSCURO  DEPORTIVO CON TIRAS  T.2;1;$799,90 ;199,98 ;$599,93 ;107,99 ;491,94 ;220;P    Extra Descuento 5%
;476;6559294;AUVY;70-5019-02-01;CORPIÑO NEGRO  DE BAÑO TRIÁNGULO  - T.1;1;$849,90 ;254,97 ;$594,93 ;107,09 ;487,84 ;220;P    Extra Descuento 5%
;476;6559294;AWUH;90-9986-04-00;PACK AZUL NAVY  DE MEDIAS COMBINADAS  - T.UNICO-TU;1;$439,90 ;131,97 ;$307,93 ;55,43 ;252,50 ;220;P    Extra Descuento 5%
;476;6559294;AXJK;3Q-0001-11-02;REMERA CELESTE  CON ATRAQUES EN MANGAS - T.M;1;$899,95 ;224,99 ;$674,96 ;121,49 ;553,47 ;220;P    Oportunidad Remera Flamé 2x $1799.9
;476;6559294;AXJN;3Q-0001-23-02;REMERA CORAL  CON ATRAQUES EN MANGAS - T.M;1;$899,95 ;224,99 ;$674,96 ;121,49 ;553,47 ;220;P    Oportunidad Remera Flamé 2x $1799.9
;476;6559294;AXTU;12-2094-02-02;MUSCULOSA NEGRO  CON CINTA SUBLIMADA EN ESPALDA - T.M;1;$949,90 ;284,97 ;$664,93 ;119,69 ;545,24 ;220;P    Extra Descuento 5%
;476;6559294;AXVS;20-2018-13-03;MUSCULOSA AMARILLO  ESCOTE CUADRADO - T.L;1;$799,95 ;199,99 ;$599,96 ;107,99 ;491,97 ;220;P    Oportunidad Musculosa Escote Cuadrado Morley 2x $1599.90
;476;6559294;AXVV;20-2018-82-03;MUSCULOSA VERDE OLIVA  ESCOTE CUADRADO - T.L;1;$799,95 ;199,99 ;$599,96 ;107,99 ;491,97 ;220;P    Oportunidad Musculosa Escote Cuadrado Morley 2x $1599.90
;476;6559294;AYCO;3S-4000-01-02;SHORT BLANCO  COMBINADO CON ESTAMPA EN RECORTE - T.M;1;$899,90 ;269,97 ;$629,93 ;113,39 ;516,54 ;220;P    Extra Descuento 5%
;476;6559294;AYTY;70-0098-02-04;CULOTTE NEGRO  DE BAÑO TIRO ALTO - T.4;1;$949,90 ;284,97 ;$664,93 ;119,69 ;545,24 ;220;P    Extra Descuento 5%
;476;6559294;AYQR;90-9712-9A-00;PORTA NARANJA FLUO  CELULAR FITNESS - T.UNICO-TU;1;$529,90 ;158,97 ;$370,93 ;66,77 ;304,16 ;220;P    Extra Descuento 5%
;476;6559294;AZBM;90-7286-01-00;SOQUETE BLANCO  INVISIBLE RAYAS MULTICOLOR EN PUNTA - T.UNIC;1;$234,95 ;58,74 ;$176,21 ;31,72 ;144,49 ;220;P    Oportunidad Socks invisible Multirayas 2X $469.90
;476;6559294;AYJZ;67-0662-1G-02;"REMERA AMARILLO INTENSO  ""CVKD""  T.M";1;$949,90 ;284,97 ;$664,93 ;119,69 ;545,24 ;220;P    Extra Descuento 5%
;476;6559294;AYTT;75-0476-3A-02;MUSCULOSA CORAL MELANGE  LENCERA COMBINADA - T.2;1;$419,94 ;0,00 ;$419,94 ;41,99 ;377,95 ;220;P    Free Premiums
;476;6559294;AYEI;5P-0002-02-02;REMERA NEGRO  COMBINADA DETALLE LASER TECH - T.M;1;$1.149,90 ;344,97 ;$804,93 ;144,89 ;660,04 ;220;P    Extra Descuento 5%
;476;6559294;AYMJ;67-2172-02-02;VESTIDO NEGRO  CON RECORTE COMBINADO EN MICROTUL - T.M;2;$1.049,90 ;629,94 ;$1.469,86 ;264,57 ;1205,29 ;220;P    Extra Descuento 5%
;476;6559294;AYGF;67-0271-13-03;REMERA AMARILLO  BÁSICA - T.L;1;$699,95 ;174,99 ;$524,96 ;94,49 ;430,47 ;220;P    Oportunidad Remera Básica Jersey fine 2X 1399.90
;476;6559294;AYGI;67-0271-45-03;REMERA VERDE FLUO  BÁSICA - T.L;1;$699,95 ;174,99 ;$524,96 ;94,49 ;430,47 ;220;P    Oportunidad Remera Básica Jersey fine 2X 1399.90
;476;6559294;AYEL;5P-0002-14-02;REMERA FRANCIA  COMBINADA DETALLE LASER TECH - T.M;1;$899,90 ;269,97 ;$629,93 ;113,39 ;516,54 ;220;P    Extra Descuento 5%
;476;6559294;AYUP;20-0004-74-03;REMERA AZUL NOCHE  CON ABERTURA EN HOMBRO - T.L;1;$489,93 ;0,00 ;$489,93 ;48,99 ;440,94 ;220;P    Free Premiums
;476;6559294;AYHO;67-0279-03-03;VESTIDO ROJO  REMERÓN CON TEJIDO EN RUEDO - T.L;1;$1.499,90 ;449,97 ;$1.049,93 ;188,99 ;860,94 ;220;P    Extra Descuento 5%
;476;6559294;AZBL;90-7285-01-00;SOQUETE BLANCO  INVISIBLE CON RAYAS ENGAMADAS EN PUNTA - T.U;1;$234,95 ;58,74 ;$176,21 ;31,72 ;144,49 ;220;P    Oportunidad Socks invisible Multirayas 2X $469.90
;476;6564109;AYEQ;5P-2001-19-01;MUSCULOSA OBISPO  COMBINADA DETALLE RÉFLEX - T.S;1;$899,90 ;269,97 ;$629,93 ;113,39 ;516,54 ;220;P    Extra Descuento 5%
;907;6559351;DHL;75-0016-01-02;BOXER BLANCO  JERSEY CON LYCRA BLCO - T.M;1;$659,90 ;197,97 ;$461,93 ;83,15 ;378,78 ;220;P    Extra Descuento 5%
;907;6559351;AWLS;75-0449-03-03;COLALESS ROJO  BASICA  - T.3;2;$274,95 ;137,48 ;$412,43 ;74,24 ;338,19 ;220;P    Oportunidad Bombachas 2X $549.90
;907;6559351;AXPX;07-4032-02-02;SHORT NEGRO  COMBINADO CON CINTA SUBLIMADA - T.M;1;$899,90 ;269,97 ;$629,93 ;113,39 ;516,54 ;220;P    Extra Descuento 5%
;907;6559351;AYXE;03-0135-1A-02;MINIVESTIDO MOSTAZA  CON CHARRETERAS - T.2;1;$1.199,90 ;359,97 ;$839,93 ;151,19 ;688,74 ;220;P    Extra Descuento 5%
;907;6559351;AZBT;67-0271-97-03;REMERA CORAL FLUO  BÁSICA - T.L;1;$699,95 ;174,99 ;$524,96 ;94,49 ;430,47 ;220;P    Oportunidad Remera Básica Jersey fine 2X 1399.90
;907;6559351;AYUY;70-0186-02-03;VEDETINA NEGRO  DE BAÑO TIRO ALTO - T.3;1;$899,90 ;269,97 ;$629,93 ;113,39 ;516,54 ;220;P    Extra Descuento 5%
;907;6559351;AXXA;24-4008-02-03;CICLISTA NEGRO  BÁSICO - T.3;1;$1.349,90 ;404,97 ;$944,93 ;170,09 ;774,84 ;220;P    Extra Descuento 5%
;907;6559351;AYFZ;67-0271-02-03;REMERA NEGRO  BÁSICA - T.L;1;$699,95 ;174,99 ;$524,96 ;94,49 ;430,47 ;220;P    Oportunidad Remera Básica Jersey fine 2X 1399.90
;907;6559351;AYUT;70-0185-02-01;MALLA NEGRO  ENTERA ESPALDA CAVADA - T.1;1;$1.119,93 ;0,00 ;$1.119,93 ;111,99 ;1007,94 ;220;P    Free Premiums
;907;6559351;AYKP;67-0666-72-02;REMERA GRIS MELANGE OSCURO  AIRBRUSHED PRINT CON BOLSILLO - ;1;$1.149,90 ;344,97 ;$804,93 ;144,89 ;660,04 ;220;P    Extra Descuento 5%
;703;6559301;AYAD;2N-4501-14-04;SHORT FRANCIA  COMBINADO CON VIVO A CONTRATONO - T.XL;1;$1.149,90 ;344,97 ;$804,93 ;144,89 ;660,04 ;220;P    Extra Descuento 5%
;703;6559301;AYPN;7T-0001-22-00;TÚNICA CRUDO  PRINT ACEBRADO CON VISTA - T.UNICO-TU;1;$1.599,90 ;479,97 ;$1.119,93 ;201,59 ;918,34 ;220;P    Extra Descuento 5%
;703;6559301;AXVS;20-2018-13-03;MUSCULOSA AMARILLO  ESCOTE CUADRADO - T.L;1;$799,95 ;199,99 ;$599,96 ;107,99 ;491,97 ;220;P    Oportunidad Musculosa Escote Cuadrado Morley 2x $1599.90
;703;6559309;AYEF;5L-3002-93-02;PANTALÓN CRUDO MELANGE  CROPPED CON GALÓN LATERAL  T.M;1;$999,90 ;0,00 ;$999,90 ;99,99 ;899,91 ;220;PR5  GANGAS DE ENERO  
;703;6559301;AXQA;07-4033-9A-02;SHORT NARANJA FLUO  DEPORTIVO COMBINADO - T.M;1;$531,93 ;0,00 ;$531,93 ;53,19 ;478,74 ;220;P    Free Premiums
;703;6559301;AOUN;6C-0001-01-01;REMERA BLANCO  CON TAJOS LATERALES - T.S;1;$599,94 ;0,00 ;$599,94 ;59,99 ;539,95 ;220;P    Free Premiums
;703;6559301;AYQG;81-4519-12-03;BERMUDA GRIS MELANGE  CON PRETINA TEJIDA Y CINTA LATERAL - T;1;$1.729,90 ;518,97 ;$1.210,93 ;217,97 ;992,96 ;220;P    Extra Descuento 5%
;703;6559301;AASX;81-3501-02-03;BABUCHA NEGRO  CORTE JEAN - T.L;1;$2.199,90 ;659,97 ;$1.539,93 ;277,19 ;1262,74 ;220;P    Extra Descuento 5%
;703;6559301;AWDN;4B-4502-02-04;SHORT NEGRO  DEPORTIVO COMBINADO CINTA REFLEX - T.XL;2;$1.399,90 ;839,94 ;$1.959,86 ;352,77 ;1607,09 ;220;P    Extra Descuento 5%
;703;6559301;AYNF;67-2178-14-03;VESTIDO FRANCIA  CON APLIQUE BOCA - T.L;1;$1.299,90 ;389,97 ;$909,93 ;163,79 ;746,14 ;220;P    Extra Descuento 5%
;703;6559309;AYEG;5L-3002-93-03;PANTALÓN CRUDO MELANGE  CROPPED CON GALÓN LATERAL  T.L;1;$999,90 ;0,00 ;$999,90 ;99,99 ;899,91 ;220;PR5  GANGAS DE ENERO  
;703;6559309;AZGE;81-4520-18-12;BERMUDA VERDE ENERGIA  BASICA DE NENE  - T.12;1;$559,90 ;0,00 ;$559,90 ;55,99 ;503,91 ;220;PR5  GANGAS DE ENERO  
;703;6559301;AXVY;20-2018-85-03;MUSCULOSA MANDARINA  ESCOTE CUADRADO - T.L;1;$799,95 ;199,99 ;$599,96 ;107,99 ;491,97 ;220;P    Oportunidad Musculosa Escote Cuadrado Morley 2x $1599.90
;703;6559301;AYQW;90-0014-35-00;CUELLO VERDE MILITAR  PRINT CAMUFLADO TRNG - T.UNICO-TU;1;$399,90 ;119,97 ;$279,93 ;50,39 ;229,54 ;220;P    Extra Descuento 5%
